{
  "$schema": "../../schemas/libFormula.schema.json",
  "name": "Can Share",
  "description": "Return a Boolean indicating whether the provided data can be shared (with the \"Share\" action).",
  "arguments": [
    {
      "name": "URL",
      "description": "The URL you want to check.",
      "type": {
        "type": "String"
      },
      "formula": {
        "type": "value",
        "value": null
      }
    },
    {
      "name": "Title",
      "description": "The title you want to check.",
      "type": {
        "type": "String"
      },
      "formula": {
        "type": "value",
        "value": null
      }
    },
    {
      "name": "Text",
      "description": "The text you want to check.",
      "type": {
        "type": "String"
      },
      "formula": {
        "type": "value",
        "value": null
      }
    }
  ],
  "mdnUrl": ""
}
