{
  "$schema": "../../schemas/libFormula.schema.json",
  "name": "Get",
  "description": "Extract a value from an Object, Array or String at the specified path.",
  "arguments": [
    {
      "name": "Object",
      "formula": {
        "type": "value",
        "value": null
      },
      "description": "The Object, Array or String you want to extract an item from.",
      "type": {
        "type": "Array \\| Object \\| String"
      }
    },
    {
      "name": "Path",
      "formula": {
        "type": "value",
        "value": "Item"
      },
      "description": "The Path can be either a Number, a String, or an Array.",
      "type": {
        "type": "Array<String> \\| Number \\| String"
      }
    }
  ],
  "output": {
    "description": "The value found at the Path. If no value is found, this value of the output is Null.",
    "type": {
      "type": "Any"
    }
  },
  "mdnUrl": ""
}
