{
  "$schema": "../../schemas/libFormula.schema.json",
  "name": "Boolean",
  "description": "Convert a value of any type to a Boolean.",
  "mdnUrl": "",
  "arguments": [
    {
      "name": "Input",
      "description": "Value of any type.",
      "type": { "type": "Any" },
      "formula": { "type": "value", "value": "1" }
    }
  ],
  "output": {
    "description": "The input value converted to a Boolean. False and Null will return False, all other values will return True.",
    "type": { "type": "Boolean" }
  }
}
