{
  "$schema": "../../schemas/libFormula.schema.json",
  "name": "Range",
  "description": "Create an Array of numbers between a Min and Max value.",
  "arguments": [
    {
      "formula": {
        "type": "value",
        "value": 0
      },
      "name": "Min",
      "description": "The smallest value in the list.",
      "type": {
        "type": "Number"
      }
    },
    {
      "name": "Max",
      "formula": {
        "type": "value",
        "value": 10
      },
      "description": "The largest value in the list.",
      "type": {
        "type": "Number"
      }
    }
  ],
  "output": {
    "description": "An Array containing all the numbers between Min and Max, inclusive.",
    "type": {
      "type": "Array"
    }
  },
  "mdnUrl": ""
}
