{
  "$schema": "../../schemas/libFormula.schema.json",
  "name": "Greater or equal",
  "description": "Compute whether a value is larger than or equal to another value.",
  "arguments": [
    {
      "name": "First",
      "formula": {
        "type": "value",
        "value": ""
      },
      "description": "First value to be compared.",
      "type": {
        "type": "Number"
      }
    },
    {
      "name": "Second",
      "formula": {
        "type": "value",
        "value": ""
      },
      "description": "Second value to be compared.",
      "type": {
        "type": "Number"
      }
    }
  ],
  "output": {
    "description": "Returns True if the first Number is larger than or equal to the second Number.",
    "type": {
      "type": "Boolean"
    }
  },
  "mdnUrl": ""
}
