{
  "$schema": "../../schemas/libFormula.schema.json",
  "name": "Last",
  "description": "Get the last item in an Array.",
  "arguments": [
    {
      "name": "Array",
      "formula": {
        "type": "value",
        "value": []
      },
      "type": {
        "type": "Array"
      },
      "description": "The input Array."
    }
  ],
  "output": {
    "description": "The last item in the Array.",
    "type": {
      "type": "Any"
    }
  },
  "mdnUrl": ""
}
