{
  "$schema": "../../schemas/libFormula.schema.json",
  "name": "Sum",
  "description": "Return the sum of an Array of numbers.",
  "arguments": [
    {
      "name": "Array",
      "type": {
        "type": "Array"
      },
      "description": "The array of numbers to sum.",
      "formula": {
        "type": "array",
        "arguments": []
      }
    }
  ],
  "output": {
    "description": "The total sum from adding all the numbers in the Array.",
    "type": {
      "type": "Number"
    }
  },
  "mdnUrl": ""
}
